{
  "id": "shadow_1",
  "specVersion": "0.1",
  "tenantId": "tenant_demo",
  "proposalId": "prop_1",
  "policyDecision": {
    "decision": "require_approval",
    "reasons": [
      { "code": "OVER_THRESHOLD", "message": "amount 15000 USD exceeds rule maxAmount 10000 USD" }
    ],
    "policyVersion": "1.0.0",
    "evaluatedAt": "2026-01-15T10:02:00Z"
  },
  "wouldAutoExecute": false,
  "suggestedAction": {
    "actionType": "refund",
    "reasonCode": "damaged_item",
    "params": { "orderId": "order_1" },
    "amount": { "currency": "USD", "minorUnits": 15000 }
  },
  "humanOutcome": "pending",
  "createdAt": "2026-01-15T10:02:01Z"
}
